order,id,session,session_type,convention,passed,answer
1,s0_q1,0,baseline,test_naming,False,"Based on common Python testing conventions, I would suggest naming the test file `test_discounts.py`. This follows the standard pattern of using `test_` as a prefix to indicate that it's a test module"
2,s0_q2,0,baseline,error_handling,False,"Based on our previous conversation, I'll write the function to raise an error for an invalid discount code.  Here's the code:  ```python def validate_discount_code(code):     """"""     Raises ValueError"
3,s0_q3,0,baseline,docstring,True,"Based on the remembered conventions and patterns used in similar codebases, I would suggest the following:  ```python def apply_discount(order, discount_code):     """"""     Applies a discount to the sp"
4,s0_q4,0,baseline,imports,False,"Based on standard Python conventions and practices, here's how you would write the import section for a new file:  ```python import datetime from requests import get  # or Session, if needed from your"
5,s0_q5,0,baseline,logging,True,"To log an info message inside a function for the discounts module, you can use the Python built-in `logging` module, which is commonly used for logging messages in applications.  First, make sure to c"
6,s1_q1,1,teach,test_naming,True,"Based on the convention that test files must be named `test_<module>_spec.py`, I would suggest naming the test file `test_notifications_spec.py`. This follows the exact pattern specified in the conven"
7,s1_q2,1,teach,error_handling,True,"Here's the updated function:  ```python from app.errors import AppError  def notify_user(title, message):     """"""     Raises AppError if the notification fails to send.          Args:         title (s"
8,s1_q3,1,teach,docstring,True,"Here's an example of how to write a docstring for the function:  ```python def send_notification(title: str, message: str) -> None:     """"""     Sends a notification.      Args:         title (str): Th"
9,s1_q4,1,teach,imports,True,Here is the import section for a new file: ```python import logging from typing import Any  from fastapi import Request from fastapi.responses import JSONResponse  from .notifications import Notificat
10,s1_q5,1,teach,logging,True,"To log an info message inside a new function for the notifications module, you can follow these steps:  ```python def send_notification(title, message):     """"""     Sends a notification with the speci"
11,s2_q1,2,recall,test_naming,True,"Based on the convention that test files must be named `test_<module>_spec.py`, I would suggest naming the test file `test_inventory_spec.py`.   So, my answer is: `test_inventory_spec.py`"
12,s2_q2,2,recall,error_handling,True,"Here's the function with a description:  ```python class AppError(Exception):     def __init__(self, message: str, code: int, cause=None):         """"""         Custom exception for application errors. "
13,s2_q3,2,recall,docstring,False,"Here's the function with a description:  ```python def update_inventory_stock(item_id: str, quantity_change: int) -> None:     """"""     Update the inventory stock level of an item.      Args:         i"
14,s2_q4,2,recall,imports,False,"Based on standard Python conventions and practices, here's how you would write the import section for a new file:  ```python import datetime from os import path  # assuming only 'path' is needed from "
15,s2_q5,2,recall,logging,True,"To log a warning inside a function, you can use the `logging` module as follows:  ```python import logging  # Set up the logger logger = logging.getLogger(__name__)  def update_inventory_item(item_id:"
16,s3_q1,3,recall,test_naming,True,"Based on the convention that test files must be named `test_<module>_spec.py`, I would suggest naming the test file `test_webhooks_spec.py`.   So, my answer is: `test_webhooks_spec.py`"
17,s3_q2,3,recall,error_handling,True,"```python import logging  class AppError(Exception):     """"""Base class for application-specific exceptions""""""          def __init__(self, message, code):         self.message = message         self.co"
18,s3_q3,3,recall,docstring,True,"Here's the docstring for a function that verifies a webhook signature:  ```python def verify_webhook_signature(payload: str, signature: str, secret_key: str) -> bool:     """"""     Verifies the signatur"
19,s3_q4,3,recall,imports,True,"Here's the import section for a new file based on the given requirements:  ```python import json  from httpx import Client, Response  from .webhooks import WebhookService ```  This meets the import or"
20,s3_q5,3,recall,logging,True,"To log an error inside a new function for the webhooks module, you should follow these steps:  1.  Import the `logging` module and configure it. 2.  Create a logger instance using `logging.getLogger(_"
21,s4_q1,4,recall,test_naming,True,"Based on the convention that test files must be named `test_<module>_spec.py`, I would suggest naming the test file `test_subscriptions_spec.py`. This follows the exact pattern specified in the conven"
22,s4_q2,4,recall,error_handling,True,"```python import logging  class AppError(Exception):     """"""Base class for exceptions in this application""""""          def __init__(self, message, code=500):         self.message = message         self"
23,s4_q3,4,recall,docstring,True,"Here's the code with a Google-style docstring: ```python import logging  def renew_subscription(subscription_id):     """"""     Renews an expired subscription.      Args:         subscription_id (str): "
24,s4_q4,4,recall,imports,False,"Based on the provided information, here's how you would write the import section for a new file:  ```python import datetime from typing import Optional  # assuming you need this in the stdlib group fr"
25,s4_q5,4,recall,logging,True,"To log an info message inside a new function for the subscriptions module, you can use the same approach as before:  ```python import logging  def subscribe(user_id):     """"""     Subscribes a user to "
26,s5_q1,5,recall,test_naming,True,"Based on the convention that test files must be named `test_<module>_spec.py`, I would suggest naming the test file `test_invoices_spec.py`.   So, my answer is: `test_invoices_spec.py`"
27,s5_q2,5,recall,error_handling,True,"Here's how you can write such a function:  ```python class AppError(Exception):     """"""Base exception for application-specific errors.""""""     def __init__(self, message: str, code: int = 1) -> None:  "
28,s5_q3,5,recall,docstring,True,"Here is a docstring for the `generate_invoice_pdf` function in Google-style format: ```python def generate_invoice_pdf(invoice_data: dict) -> bytes:     """"""     Generate an invoice PDF from provided i"
29,s5_q4,5,recall,imports,True,"Here is the import section for the new file: ```python import logging import re from typing import Any  from fastapi import Request, Response from fastapi.responses import JSONResponse  from .invoices"
30,s5_q5,5,recall,logging,True,"To log a warning inside a new function for the invoices module, you can follow these steps:  1. Import the `logging` module at the top of your file. 2. Set up a logger for the invoices module using `l"
